{
  "blueprint_id": "ikea_e2001_e2002",
  "name": "Controller - IKEA E2001/E2002 STYRBAR Remote control",
  "manufacturer": "IKEA",
  "model": "E2001/E2002",
  "model_name": "IKEA E2001/E2002 STYRBAR Remote control",
  "description": "A four-button wireless remote designed for intuitive lighting and smart device control.",
  "category": "controller",
  "supported_integrations": ["Zigbee2MQTT", "ZHA", "deCONZ"],
  "images": ["ikea_e2001_e2002.png"],
  "manual_files": ["ikea_e2001_e2002.pdf"],
  "external_references": [
    {
      "label": "Zigbee2MQTT",
      "url": "https://www.zigbee2mqtt.io/devices/E2001_E2002.html"
    },
    {
      "label": "Blakadder",
      "url": "https://zigbee.blakadder.com/Ikea_E2002.html"
    },
    {
      "label": "ZHA Quirk",
      "url": "https://github.com/zigpy/zha-device-handlers/blob/dev/zhaquirks/ikea/fourbtnremote.py"
    },
    {
      "label": "deCONZ Device",
      "url": "https://github.com/dresden-elektronik/deconz-rest-plugin/blob/master/devices/ikea/styrbar_remote_control.json"
    }
  ],
  "tags": ["zigbee", "button", "remote", "4-button"],
  "status": "active",
  "librarians": [
    {
      "id": "yarafie",
      "name": "Yasir Rafie"
    }
  ]
}
