{
  "blueprint_id": "xiaomi_wxcjkg11lm",
  "name": "Controller - Xiaomi WXCJKG11LM Aqara Opple 2 button remote",
  "manufacturer": "Xiaomi",
  "model": "WXCJKG11LM",
  "model_name": "Xiaomi WXCJKG11LM Aqara Opple 2 button remote",
  "description": "A two-button Zigbee remote control designed for flexible smart home automations and scene control.",
  "category": "controller",
  "supported_integrations": ["Zigbee2MQTT", "ZHA", "deCONZ"],
  "images": ["xiaomi_wxcjkg11lm.png"],
  "manual_files": [],
  "external_references": [
    {
      "label": "Zigbee2MQTT",
      "url": "https://www.zigbee2mqtt.io/devices/WXCJKG11LM.html"
    }
  ],
  "tags": ["zigbee", "button", "remote", "2-button"],
  "status": "active",
  "librarians": [
    {
      "id": "yarafie",
      "name": "Yasir Rafie"
    }
  ]
}
