{
  "blueprint_id": "shelly_snsn_0024x",
  "name": "Controller - Shelly SNSN-0024x Plus i4 with Wall switch 4",
  "manufacturer": "Shelly",
  "model": "SNSN-0024x",
  "model_name": "Shelly SNSN-0024x Plus i4 with Wall switch 4",
  "description": "A Wi-Fi input controller designed to connect physical wall switches and trigger smart home automations.",
  "category": "controller",
  "supported_integrations": ["Shelly"],
  "images": ["shelly_snsn_0024x.png"],
  "manual_files": [],
  "external_references": [],
  "tags": ["wifi", "wall-switch", "input-module"],
  "status": "active",
  "librarians": [
    {
      "id": "yarafie",
      "name": "Yasir Rafie"
    }
  ]
}
