{
  "blueprint_id": "xiaomi_wxkg01lm",
  "name": "Controller - Xiaomi WXKG01LM Mi Wireless Switch",
  "manufacturer": "Xiaomi",
  "model": "WXKG01LM",
  "model_name": "Xiaomi WXKG01LM Mi Wireless Switch",
  "description": "A wireless Zigbee button designed for simple smart home control using single, double, and long press actions.",
  "category": "controller",
  "supported_integrations": ["Zigbee2MQTT", "ZHA", "deCONZ"],
  "images": ["xiaomi_wxkg01lm.png"],
  "manual_files": [],
  "external_references": [
    {
      "label": "Zigbee2MQTT",
      "url": "https://www.zigbee2mqtt.io/devices/WXKG01LM.html"
    }
  ],
  "tags": ["zigbee", "button", "remote"],
  "status": "active",
  "librarians": [
    {
      "id": "yarafie",
      "name": "Yasir Rafie"
    }
  ]
}
