{
  "blueprint_id": "aqara_djt11lm",
  "name": "Controller - Aqara DJT11LM Vibration Sensor",
  "manufacturer": "Aqara",
  "model": "DJT11LM",
  "model_name": "Aqara DJT11LM Vibration Sensor",
  "description": "A Zigbee vibration sensor designed to detect movement, tilt, and vibration for advanced automation triggers.",
  "category": "controller",
  "supported_integrations": ["Zigbee2MQTT"],
  "images": ["aqara_djt11lm.png"],
  "manual_files": ["aqara_djt11lm.pdf"],
  "external_references": [
    {
      "label": "Zigbee2MQTT",
      "url": "https://www.zigbee2mqtt.io/devices/DJT11LM.html"
    },
    {
      "label": "Zigbee2MQTT",
      "url": "https://www.zigbee2mqtt.io/devices/WXKG13LM.html"
    },
    {
      "label": "Blakadder",
      "url": "https://zigbee.blakadder.com/Aqara_DJT11LM.html"
    }
  ],
  "tags": ["zigbee", "sensor", "vibration"],
  "status": "active",
  "librarians": [
    {
      "id": "yarafie",
      "name": "Yasir Rafie"
    }
  ]
}
