{
  "blueprint_id": "ikea_e1743",
  "name": "Controller - IKEA E1743 TRÅDFRI On/Off Switch & Dimmer",
  "manufacturer": "IKEA",
  "model": "E1743",
  "model_name": "IKEA E1743 TRÅDFRI On/Off Switch & Dimmer",
  "description": "A two-button wireless dimmer switch that allows simple on/off and brightness control of connected lights.",
  "category": "controller",
  "supported_integrations": ["Zigbee2MQTT", "ZHA", "deCONZ"],
  "images": ["ikea_e1743.png"],
  "manual_files": [],
  "external_references": [
    {
      "label": "Zigbee2MQTT",
      "url": "https://www.zigbee2mqtt.io/devices/E1743.html"
    },
    {
      "label": "Blakadder",
      "url": "https://zigbee.blakadder.com/Ikea_E1743.html"
    },
    {
      "label": "deCONZ Device",
      "url": "https://github.com/dresden-elektronik/deconz-rest-plugin/blob/8ae69a976bca13f22e8002a13ebe798d1e26c086/button_maps.json#L236"
    }
  ],
  "tags": ["zigbee", "dimmer", "light"],
  "status": "active",
  "librarians": [
    {
      "id": "yarafie",
      "name": "Yasir Rafie"
    }
  ]
}
