{
  "blueprint_id": "philips_324131092621",
  "name": "Controller - Philips 324131092621 Hue Dimmer switch",
  "manufacturer": "Philips",
  "model": "UNKNOWN",
  "model_name": "Philips 324131092621 Hue Dimmer switch",
  "description": "A Zigbee Hue Dimmer Switch designed for wireless control of lights, scenes, and brightness levels.",
  "category": "controller",
  "supported_integrations": ["Zigbee2MQTT", "ZHA", "deCONZ"],
  "images": ["philips_324131092621.png"],
  "manual_files": [],
  "external_references": [
    {
      "label": "Zigbee2MQTT",
      "url": "https://www.zigbee2mqtt.io/devices/324131092621.html"
    }
  ],
  "tags": ["zigbee", "dimmer", "light"],
  "status": "active",
  "librarians": [
    {
      "id": "yarafie",
      "name": "Yasir Rafie"
    }
  ]
}
