{
  "blueprint_id": "ikea_e1766",
  "name": "Controller - IKEA E1766 TRÅDFRI Open/Close Remote",
  "manufacturer": "IKEA",
  "model": "E1766",
  "model_name": "IKEA E1766 TRÅDFRI Open/Close Remote",
  "description": "A wireless open/close remote designed for controlling blinds, curtains, and similar smart home devices.",
  "category": "controller",
  "supported_integrations": ["Zigbee2MQTT", "ZHA", "deCONZ"],
  "images": ["ikea_e1766.png"],
  "manual_files": [],
  "external_references": [
    {
      "label": "Zigbee2MQTT",
      "url": "https://www.zigbee2mqtt.io/devices/E1766.html"
    }
  ],
  "tags": ["zigbee", "remote", "open-close"],
  "status": "active",
  "librarians": [
    {
      "id": "yarafie",
      "name": "Yasir Rafie"
    }
  ]
}
