{
  "blueprint_id": "simple_safe_scheduler",
  "name": "Simple Safe Scheduler",
  "description": "A simple scheduler which executes a certain action at a given time, checking and eventually re-executing the action if the automation did not run at the expected time (e.g. due to a disruptive event).",
  "category": "automation",
  "status": "active",
  "images": ["simple_safe_scheduler.png"],
  "manual_files": ["simple_safe_scheduler.pdf"],
  "external_references": [],
  "supported_integrations": [],
  "tags": ["event", "schedule", "time"],
  "librarians": [
    {
      "id": "EPMatt",
      "name": "EPMatt"
    }
  ]
}
