{
  "blueprint_id": "media_player",
  "name": "Hook - Media Player",
  "description": "This Hook blueprint allows building a controller-based automation to control a media player. Supports volume setting, play/pause and track selection.",
  "category": "hook",
  "status": "active",
  "images": ["media_player.png"],
  "manual_files": ["media_player.pdf"],
  "external_references": [],
  "supported_integrations": [],
  "tags": [
    "forward",
    "mute",
    "next",
    "pause",
    "play",
    "previous",
    "reverse",
    "stop",
    "volume"
  ],
  "librarians": [
    {
      "id": "EPMatt",
      "name": "EPMatt"
    }
  ]
}
