{
  "blueprint_id": "xiaomi_wxcjkg13lm",
  "name": "Controller - Xiaomi WXCJKG13LM Aqara Opple 6 button remote",
  "manufacturer": "Xiaomi",
  "model": "WXCJKG13LM",
  "model_name": "Xiaomi WXCJKG13LM Aqara Opple 6 button remote",
  "description": "A six-button Zigbee remote control offering extensive flexibility for controlling multiple smart home actions.",
  "category": "controller",
  "supported_integrations": ["Zigbee2MQTT", "ZHA", "deCONZ"],
  "images": ["xiaomi_wxcjkg13lm.png"],
  "manual_files": [],
  "external_references": [
    {
      "label": "Zigbee2MQTT",
      "url": "https://www.zigbee2mqtt.io/devices/WXCJKG13LM.html"
    }
  ],
  "tags": ["zigbee", "button", "remote", "6-button"],
  "status": "active",
  "librarians": [
    {
      "id": "yarafie",
      "name": "Yasir Rafie"
    }
  ]
}
