{
  "blueprint_id": "sonoff_snzb01",
  "name": "Controller - SONOFF SNZB-01 Wireless Switch",
  "manufacturer": "SONOFF",
  "model": "SNZB-01",
  "model_name": "SONOFF SNZB-01 Wireless Switch",
  "description": "A compact Zigbee wireless switch designed for triggering scenes and automations with button presses.",
  "category": "controller",
  "supported_integrations": ["Zigbee2MQTT", "ZHA", "deCONZ"],
  "images": ["sonoff_snzb01.png"],
  "manual_files": [],
  "external_references": [
    {
      "label": "Zigbee2MQTT",
      "url": "https://www.zigbee2mqtt.io/devices/SNZB-01.html"
    }
  ],
  "tags": ["zigbee", "button"],
  "status": "active",
  "librarians": [
    {
      "id": "yarafie",
      "name": "Yasir Rafie"
    }
  ]
}
