{
  "blueprint_id": "smarthjemmet_dk_quad_zig_sw",
  "name": "Controller - Smarthjemmet.dk QUAD-ZIG-SW 4 button remote",
  "manufacturer": "Smarthjemmet.d",
  "model": "QUAD-ZIG-SW",
  "model_name": "Smarthjemmet.dk QUAD-ZIG-SW 4 button remote",
  "description": "A Zigbee four-button remote designed for controlling multiple scenes and smart home actions.",
  "category": "controller",
  "supported_integrations": ["Zigbee2MQTT"],
  "images": ["smarthjemmet_dk_quad_zig_sw.png"],
  "manual_files": [],
  "external_references": [
    {
      "label": "Zigbee2MQTT",
      "url": "https://www.zigbee2mqtt.io/devices/QUAD-ZIG-SW.html"
    }
  ],
  "tags": ["zigbee", "button", "remote", "4-button"],
  "status": "active",
  "librarians": [
    {
      "id": "yarafie",
      "name": "Yasir Rafie"
    }
  ]
}
