{
  "blueprint_id": "ikea_e2201",
  "name": "Controller - IKEA E2201 RODRET Dimmer",
  "manufacturer": "IKEA",
  "model": "E2201",
  "model_name": "IKEA E2201 RODRET Dimmer",
  "description": "A compact two-button wireless dimmer designed for simple lighting and device control.",
  "category": "controller",
  "supported_integrations": ["Zigbee2MQTT", "ZHA", "deCONZ"],
  "images": ["ikea_e2201.png"],
  "manual_files": [],
  "external_references": [
    {
      "label": "Zigbee2MQTT",
      "url": "https://www.zigbee2mqtt.io/devices/E2201.html"
    },
    {
      "label": "Blakadder",
      "url": "https://zigbee.blakadder.com/Ikea_E2201.html"
    },
    {
      "label": "deCONZ Device",
      "url": "https://github.com/dresden-elektronik/deconz-rest-plugin/blob/8ae69a976bca13f22e8002a13ebe798d1e26c086/button_maps.json#L236"
    }
  ],
  "tags": ["zigbee", "dimmer", "light"],
  "status": "active",
  "librarians": [
    {
      "id": "yarafie",
      "name": "Yasir Rafie"
    }
  ]
}
